{
  "schema_version": "3.0.0",
  "project_id": "pilot-001",
  "document_id": "doc-a812025f0d484647ac3a81c09a1055ab",
  "display_title": "pilot-story",
  "aliases": [],
  "source_relative_path": "pilot-story.md",
  "usage_role": "primary_manuscript",
  "classification": "manuscript",
  "classification_status": "approved",
  "source_status": "active",
  "structure_status": "parsed",
  "provenance_original_sha256": "9598390a498126a127077a42d001b87f3d0dceb9dd2450aa3cf3822905c7be88",
  "source_map_path": ".manga-studio/source/maps/doc-a812025f0d484647ac3a81c09a1055ab/9598390a498126a127077a42d001b87f3d0dceb9dd2450aa3cf3822905c7be88-manga_studio_text_structure-v1.0.0-boundaries-44136fa355b3678a.json",
  "source_map_checksum": "a0ea443a9df9e38905d9fe142426e7096dd6f647b801beeb51ea2a033e872db7"
}
